Basketball,How many players are on the court for one team?,five,100
Basketball,What is the diameter of a basketball?,24cm,700
Basketball,How tall in feet is the rim?,ten,200
Basketball,How many teams are in the NBA?,30,100
Basketball,Basketball court mostly constructed of which type of wood?,Maple,800
Basketball,How many seconds does an NBA team have to take a shot that hits the rim?,24,400
Basketball,What is Michael Jordan's middle name?,Jeffery,900
Basketball,What is the name of the Denver Nuggets mascot?,Rocky,500