Birds,The process of a bird losing old feathers and growing new ones is referred to as?,Molting,100
Birds,The American robin lays what colored egg?,Blue,200
Birds,What is the world's largest non-extinct bird species by weight?,Ostrich,300
Birds,Which falcon species holds the title as the fastest animal on earth?,Peregrine,400
Birds,What species of eagle is depicted on the Mexican flag?,Golden,500
Birds,What is the scientific study of birds called?, Ornithology,600
Birds,What is the smallest penguin species?,Blue,700
Birds,Which bird species lays the largest egg in relation to its body size?,Kiwi,800
